id,title,type,description,release_year,age_certification,runtime,genres,production_countries,seasons,imdb_id,imdb_score,imdb_votes,tmdb_popularity,tmdb_score,platform
tm68188,Cesar Millan: The Real Story,MOVIE,"Follow Cesar Millans rise from impoverished illegal immigrant to celebrity dog trainer to international superstar. Join Cesar as he embarks on his live world speaking tour, films his new television series in Spain and leads thousands of dogs and owners on a Pack Walk in Washington, D.C. Cesar reflects on his humble past, his family life and his ever-evolving philosophy, which inspires people to improve their relationships with their dogs while becoming the pack leader of their own lives.",2012,,45,['documentation'],['US'],,tt3249810,7.2,90,2.57,8.3,disney
ts309940,Mickey's Mousekersize,SHOW,"Mickey's Mousekersize is a short series based on Mickey Mouse Clubhouse airing on the Disney Junior programming block. It premiered on February 14, 2011. Characters featured in the short series are Mickey Mouse, Minnie Mouse, Donald Duck, Daisy Duck, Goofy, Pluto, Clarabelle Cow, and Toodles.",2011,,5,[],['US'],1,,,,2.206,10,disney
tm895746,America's Greatest Animals,MOVIE,America's Greatest Animals takes us across North America on a revelatory mission: which of the continent's landmark creatures deserve to make the list?,2012,,96,['documentation'],['US'],,,,,1.213,7.5,disney
tm274612,Winged Seduction: Birds of Paradise,MOVIE,Tim Laman a photographer for National Geographic and ornithologist Ed Scholes have been traveling to some of the most remote jungles the world has to offer in search of observing and photographing all 39 species of tropical bird. This particular group of birds are entitled as the “Birds of Paradise” and can be found in some of the last truly wild locations of New Guinea.,2012,,45,['documentation'],['US'],,tt2543062,6.6,60,1.199,5,disney
tm70151,There's No Place Like Home,MOVIE,"On December 10, 2010, Sotheby's auctioned off what could be considered the most important historical document in sports history -- James Naismith's original rules of basketball. ""There's No Place Like Home"" is the story of one man's fanatical quest to win this seminal American artifact at auction and bring the rules ""home"" to Lawrence, Kansas, where Naismith coached and taught for over 40 years.",2012,,61,['documentation'],['US'],,,,,0.6,6.4,disney
ts176104,Special Agent Oso: Three Healthy Steps,SHOW,"Special Agent Oso: Three Healthy Steps is a short series that airs in the United States and the United Kingdom during the Disney Junior programming block. It encourages children to use ""three healthy steps"" regarding eating and exercising. Characters that are featured in the short series are Special Agent Oso, Paw Pilot, Special Agent Wolfie, Special Agent Dotty, and Professor Buffo. So far, fifteen episodes have aired:",2011,,2,['animation'],['US'],1,tt1842951,6.2,16,,,disney
ts20726,Star Wars: Rebels,SHOW,A brave and clever ragtag starship crew stands up against the evil Empire as it tightens its grip on the galaxy and hunts down the last of the Jedi Knights.,2014,TV-Y7-FV,23,"['family', 'fantasy', 'scifi', 'animation', 'action']",['US'],4,tt2930604,8.1,55501,,,disney
ts5,Marvel's Agents of S.H.I.E.L.D.,SHOW,"Agent Phil Coulson of S.H.I.E.L.D. (Strategic Homeland Intervention, Enforcement and Logistics Division) puts together a team of agents to investigate the new, the strange and the unknown around the globe, protecting the ordinary from the extraordinary.",2013,TV-14,43,"['drama', 'scifi', 'action', 'thriller']",['US'],7,tt2364582,7.5,223556,487.065,7.492,disney
tm140097,Guardians of the Galaxy,MOVIE,"Light years from Earth, 26 years after being abducted, Peter Quill finds himself the prime target of a manhunt after discovering an orb wanted by Ronan the Accuser.",2014,PG-13,121,"['scifi', 'comedy', 'action']",['US'],,tt2015381,8,1125382,31.99,7.906,disney
tm157149,Into the Woods,MOVIE,"In a woods filled with magic and fairy tale characters, a baker and his wife set out to end the curse put on them by their neighbor, a spiteful witch.",2014,PG,125,"['comedy', 'horror', 'drama', 'fantasy']",['US'],,tt2180411,5.9,146157,17.221,5.749,disney
ts20839,Life Below Zero,SHOW,"Viewers go deep into an Alaskan winter to meet six tough and resilient residents as they try to stay one step ahead of storms and man-eating beasts to make it through to spring. The closest neighbor to Sue Aikens is more than 300 miles away. Eric Salitan subsists solely on what he hunts and forages. Chip and Agnes Hailstone catch fish for currency in bartering for supplies, and Andy and Kate Bassich use their pack of sled dogs for transportation.",2013,TV-PG,47,"['documentation', 'reality']",['US'],21,tt2964642,7.9,2170,37.056,7.486,disney
tm145631,The Amazing Spider-Man 2,MOVIE,"For Peter Parker, life is busy. Between taking out the bad guys as Spider-Man and spending time with the person he loves, Gwen Stacy, high school graduation cannot come quickly enough. Peter has not forgotten about the promise he made to Gwen’s father to protect her by staying away, but that is a promise he cannot keep. Things will change for Peter when a new villain, Electro, emerges, an old friend, Harry Osborn, returns, and Peter uncovers new clues about his past.",2014,PG-13,141,"['action', 'fantasy', 'history', 'war', 'comedy', 'scifi']",['US'],,tt1872181,6.6,525862,83.307,6.5,disney
tm145915,Rio 2,MOVIE,"It's a jungle out there for Blu, Jewel and their three kids after they're hurtled from Rio de Janeiro to the wilds of the Amazon. As Blu tries to fit in, he goes beak-to-beak with the vengeful Nigel, and meets the most fearsome adversary of all: his father-in-law.",2014,G,101,"['animation', 'family', 'music', 'comedy']",['US'],,tt2357291,6.3,97907,55.315,6.502,disney
ts20731,Running Wild with Bear Grylls,SHOW,"The famed survivalist takes A-list celebrities on journeys into the wildest locations around the world, forcing the stars to push their bodies and minds to the limit to successfully complete the adventure of a lifetime.",2014,TV-PG,44,"['action', 'reality', 'comedy']",['US'],6,tt3816666,7.6,2973,84.389,7.1,disney
ts35339,The Evermoor Chronicles,SHOW,"A young girl and her blended family move to the small cottage town of Evermoor. All is well until sinister things start to happen, magic tapestries, an enchanted typewriter. Only a few of the strange things found in the town of Evermoor.",2014,TV-PG,22,"['action', 'family', 'fantasy']",['GB'],2,tt3602560,6.2,841,22.498,6.8,disney
ts77191,The Great Christmas Light Fight,SHOW,Four families will compete each week to transform their homes for the holidays in just 21 days.,2013,TV-PG,43,['reality'],['US'],10,tt3233452,6.7,294,3.363,9.444,disney
ts20813,black-ish,SHOW,"A family man struggles to gain a sense of cultural identity while raising his kids in a predominantly white, upper-middle-class neighborhood.",2014,TV-14,21,"['comedy', 'documentation', 'history']",['US'],8,tt3487356,7.1,22208,232.702,7.313,disney
tm187305,The Wolverine,MOVIE,"Wolverine faces his ultimate nemesis - and tests of his physical, emotional, and mortal limits - in a life-changing voyage to modern-day Japan.",2013,PG-13,139,"['action', 'scifi', 'fantasy']",['US'],,tt1430132,6.7,484684,7.781,6.398,disney
ts38704,"Dr. Oakley, Yukon Vet",SHOW,"Spanning thousands of acres and incorporating hundreds of species of animals; Michelle Oakley’s veterinary practice is Yukon tough. There is no such thing as a typical day in Michelle’s practice. House calls can range from expelling dogs anal glands to getting chased down by the very large Arctic musk-ox. Accompanied by her teenage daughters and armed with humor as sharp as scalpel, Michelle deftly juggles being a full time Veterinarian, wife and doctor; taking us into unexplored and unexamined regions of the Yukon.",2014,TV-PG,48,['reality'],['US'],12,tt3593456,8.5,705,17.14,5.2,disney
tm181359,Frozen,MOVIE,"Young princess Anna of Arendelle dreams about finding true love at her sister Elsa’s coronation. Fate takes her on a dangerous journey in an attempt to end the eternal winter that has fallen over the kingdom. She's accompanied by ice delivery man Kristoff, his reindeer Sven, and snowman Olaf. On an adventure where she will find out what friendship, courage, family, and true love really means.",2013,PG,102,"['fantasy', 'family', 'animation', 'comedy']",['US'],,tt2294629,7.4,650507,94.049,7.246,disney
tm159149,Captain America: The Winter Soldier,MOVIE,"After the cataclysmic events in New York with The Avengers, Steve Rogers, aka Captain America is living quietly in Washington, D.C. and trying to adjust to the modern world. But when a S.H.I.E.L.D. colleague comes under attack, Steve becomes embroiled in a web of intrigue that threatens to put the world at risk. Joining forces with the Black Widow, Captain America struggles to expose the ever-widening conspiracy while fighting off professional assassins sent to silence him at every turn. When the full scope of the villainous plot is revealed, Captain America and the Black Widow enlist the help of a new ally, the Falcon. However, they soon find themselves up against an unexpected and formidable enemy—the Winter Soldier.",2014,PG-13,128,"['action', 'scifi', 'thriller']",['US'],,tt1843866,7.8,883249,33.428,7.669,disney
tm179159,Thor: The Dark World,MOVIE,"Thor fights to restore order across the cosmos… but an ancient race led by the vengeful Malekith returns to plunge the universe back into darkness. Faced with an enemy that even Odin and Asgard cannot withstand, Thor must embark on his most perilous and personal journey yet, one that will reunite him with Jane Foster and force him to sacrifice everything to save us all.",2013,PG-13,112,"['fantasy', 'action']",['US'],,tt1981115,6.8,712224,57.312,6.535,disney
ts20281,Sofia the First,SHOW,"Set in the storybook world of Enchancia, this is the story of Princess Sofia, an adventurous little girl who is learning how to adjust to royal life after her mom marries the king and she becomes a princess overnight.",2013,TV-Y,24,"['scifi', 'animation', 'family', 'fantasy']",['US'],4,tt2136138,6.9,3527,139.489,7.234,disney
tm177964,Iron Man 3,MOVIE,"When Tony Stark's world is torn apart by a formidable terrorist called the Mandarin, he starts an odyssey of rebuilding and retribution.",2013,PG-13,130,"['action', 'scifi']",['US'],,tt1300854,7.1,884252,63.974,6.927,disney
tm153184,Night at the Museum: Secret of the Tomb,MOVIE,"When the magic powers of The Tablet of Ahkmenrah begin to die out, Larry Daley spans the globe, uniting favorite and new characters while embarking on an epic quest to save the magic before it is gone forever.",2014,PG,89,"['comedy', 'fantasy', 'family']","['US', 'GB']",,tt2692250,6.2,132085,38.227,6.207,disney
tm148170,Big Hero 6,MOVIE,"A special bond develops between plus-sized inflatable robot Baymax, and prodigy Hiro Hamada, who team up with a group of friends to form a band of high-tech heroes.",2014,PG,102,"['comedy', 'drama', 'family', 'fantasy', 'scifi', 'animation', 'action']",['US'],,tt2245084,7.8,488911,87.132,7.7,disney
tm159620,Toy Story of Terror!,MOVIE,"What starts out as a fun road trip for the Toy Story gang takes an unexpected turn for the worse when the trip detours to a roadside motel. After one of the toys goes missing, the others find themselves caught up in a mysterious sequence of events that must be solved before they all suffer the same fate in this Toy Story of Terror.",2013,G,22,"['animation', 'comedy', 'family', 'action', 'fantasy', 'horror']",['US'],,tt2446040,7.5,17246,2.191,7.19,disney
tm179573,Percy Jackson: Sea of Monsters,MOVIE,"In their quest to confront the ultimate evil, Percy and his friends battle swarms of mythical creatures to find the mythical Golden Fleece and to stop an ancient evil from rising.",2013,PG,106,"['fantasy', 'family']",['US'],,tt1854564,5.7,123305,25.712,6.027,disney
ts20822,Liv and Maddie,SHOW,"The exploits of identical twins Liv, a former television star back home in Wisconsin and in the process of adding movie star to her credits, as well as beginning to focus on her music career, and Maddie, an outstanding student and basketball phenomenon recovering from an injured knee. The series centers on the unbreakable bond the twins share though they have wildly different personalities. To complicate their teenage lives, both parents work at their high school and their younger brothers are always stirring up trouble.",2013,TV-G,23,"['comedy', 'drama', 'family']",['US'],4,tt2794380,6.3,8117,141.085,8.116,disney
tm141973,The Fault in Our Stars,MOVIE,"Despite the tumor-shrinking medical miracle that has bought her a few years, Hazel has never been anything but terminal, her final chapter inscribed upon diagnosis. But when a patient named Augustus Waters suddenly appears at Cancer Kid Support Group, Hazel's story is about to be completely rewritten.",2014,PG-13,126,"['romance', 'drama']",['US'],,tt2582846,7.7,394262,31.715,7.6,disney
ts20027,Once Upon a Time in Wonderland,SHOW,"In Victorian England, the young and beautiful Alice tells a tale of a strange new land that exists on the other side of a rabbit hole. Thinking Alice insane, her doctors aim to make her forget everything. While Alice is ready to put it all behind her, she knows this world is real. In the nick of time, the Knave of Hearts and the White Rabbit save her from a doomed fate. Together, the trio tumble down the rabbit hole to Wonderland, where nothing is impossible.",2013,TV-PG,43,"['drama', 'scifi', 'fantasy', 'romance']",['US'],1,tt2802008,6.9,12782,83.113,7,disney
tm185712,Marvel One-Shot: Agent Carter,MOVIE,"The film takes place one year after the events of Captain America: The First Avenger, in which Agent Carter, a member of the Strategic Scientific Reserve, is in search of the mysterious Zodiac.",2013,PG-13,15,"['fantasy', 'action', 'scifi']",['US'],,,,,16.663,7.2,disney
tm145004,"Alexander and the Terrible, Horrible, No Good, Very Bad Day",MOVIE,"Alexander's day begins with gum stuck in his hair, followed by more calamities. Though he finds little sympathy from his family and begins to wonder if bad things only happen to him, his mom, dad, brother, and sister all find themselves living through their own terrible, horrible, no good, very bad day.",2014,PG,81,"['family', 'comedy', 'fantasy', 'drama', 'european']",['US'],,tt1698641,6.2,45997,14.136,6.2,disney
ts43947,Science of Stupid,SHOW,"This show combines cold hard science with some of the craziest, most spectacular and painful user generated clips ever recorded. Richard Hammond introduces all manner of mishaps featuring brave, if misguided individuals from around the world and then explains the science behind their failure and humiliation with the use of bespoke animations and super slo-mo cinematography. Every episode features between 50 and 60 clips of misadventure – ordinary folk making extraordinary mistakes. Each week watch stunts involving weightlifting, shooting guns or jumping over cars, that have gone wrong, paused, re-wound, and re-played and analysed to determine exactly what went wrong and why. Richard explains the physics, chemistry and biology at play, then presents forensic details to explain the stupidity that resulted in failure. He’ll look at everything including weight, volume, momentum, combustion and even how the brain operates. This is misadventure explained. This is the Science of Stupid.",2014,,22,"['reality', 'comedy']",['GB'],8,tt3824414,6.7,833,13.684,6.8,disney
ts20042,Marvel's Avengers,SHOW,"The further adventures of the Marvel Universe's mightiest general membership superhero team. With an all-star roster consisting of Iron Man, Captain America, Thor, Hulk, Hawkeye, Falcon and, occasionally--when she feels like it and only when she feels like it--Black Widow, the Avengers are a team in the truest sense. The Avengers save the world from the biggest threats imaginable--threats no single super hero could withstand.",2013,TV-Y7,22,"['action', 'scifi', 'animation', 'comedy', 'drama', 'family']",['US'],5,tt2455546,7,7388,341.529,7.626,disney
tm155023,Toy Story That Time Forgot,MOVIE,"During a post-Christmas play date, the gang find themselves in uncharted territory when the coolest set of action figures ever turn out to be dangerously delusional. It's all up to Trixie, the triceratops, if the gang hopes to return to Bonnie's room in this Toy Story That Time Forgot.",2014,G,22,"['comedy', 'family', 'fantasy', 'animation']",['US'],,tt3473654,7.1,12769,35.763,7,disney
tm186511,Monsters University,MOVIE,A look at the relationship between Mike and Sulley during their days at Monsters University — when they weren't necessarily the best of friends.,2013,G,104,"['animation', 'family', 'comedy', 'fantasy', 'scifi']",['US'],,tt1453405,7.2,380462,56.991,7.031,disney
ts34355,Mighty Med,SHOW,"Mighty Med is a live-action comedy series starring popular Disney Channel stars Bradley Steven Perry and Jake Short, premieres as a special one-hour event, October 7 on Disney XD. The series is created by Jim Bernstein and Andy Schwartz, and is executive produced by Bernstein and Stephen Engel.",2013,TV-Y7,25,"['comedy', 'family', 'scifi']",['US'],2,tt2573338,6.5,2360,78.764,7.746,disney
tm180359,Big Shot,MOVIE,"A meteoric rise and tragic fall are captured in this brief history of a beloved sports team and a man who took a chance. When the New York Islanders first burst on the national hockey scene, the team was unstoppable. Winning four straight Stanley Cups, it became the pride of Long Island, until subsequent years of turmoil left the Islanders in dire straits. Enter John Spano, an obscure Texas millionaire with big dreams and a persuasive smile.  Director and avid Islanders fan Kevin Connolly of HBO’s Entourage gets an earnest play-by-play from a man who exaggerated his social and monetary profile so vastly that he actually took control of an NHL franchise. With testimony from sports analysts and federal investigators, Connolly skillfully pieces together this unbelievable story.",2013,,77,['documentation'],['US'],,,,,0.748,7,disney
tm150979,Muppets Most Wanted,MOVIE,"While on a grand world tour, The Muppets find themselves wrapped into an European jewel-heist caper headed by a Kermit the Frog look-alike and his dastardly sidekick.",2014,PG,107,"['family', 'comedy', 'action', 'crime']","['GB', 'US']",,tt2281587,6.4,36437,16.157,6.3,disney
ts20133,Girl Meets World,SHOW,"The adventures of relatable and adventurous Riley Matthews, the tween daughter of Cory and Topanga Matthews, and her bold best friend Maya as they traverse the twists and turns of teenage years at Manhattan's John Quincy Adams Middle School where Riley's dad is their History teacher.",2014,TV-G,23,"['comedy', 'music', 'drama', 'family']",['US'],3,tt2543796,7.1,15790,195.8,8.394,disney
ts150852,Dr K's Exotic Animal ER,SHOW,"Follow Dr. Susan Kelleher and staff as they treat all forms of exotic animals at her hospital in Deerfield Beach, FL",2014,TV-PG,46,['reality'],['US'],9,tt3986852,8.2,422,4.541,3,disney
ts35165,Ultimate Airport Dubai,SHOW,"Less than 55 years ago, Dubai International Airport was a vast desert of sand.

Today, it is a modern mecca of international air travel.

With a staggering 344,000 flights, 57 million passengers and 2 million tons of cargo flying in and out each year, it is the worlds third busiest airport for international passengers.

In Ultimate Airport Dubai, step behind-the-scenes of Dubai Internationals three massive terminals, including Terminal 3 the largest building on earth by floor space, measuring 359 football pitches in size!

With unprecedented access to all facets of this mega facility, the series follows some of the 60,000 staff working hard to keep it safe, secure, and on schedule.",2013,,45,"['documentation', 'european']",['AE'],3,tt3324124,7.4,359,5.438,8,disney
tm159757,Brian and the Boz,MOVIE,"In some ways, Barry Switzer and Brian Bosworth were made for each other. The Oklahoma coach and the linebacker he recruited to play for him were both out-sized personalities who delighted in thumbing their noses at the establishment. And in their three seasons together (1984-86), the unique father-son dynamic resulted in 31 wins and two Orange Bowl victories as Bosworth was awarded the first two Butkus Awards. But then Bosworth's alter ego: ""The Boz,"" took over both their lives and ultimately destroyed their careers. In ""Brian and The Boz,"" Bosworth looks back on the mistakes he made and passes on the lessons he learned to his son. It's a revealing portrait of a man who had and lost it all, and a trip back to a time when enough just wasn't enough.",2014,,77,['documentation'],['US'],,,,,2.177,7.1,disney
tm168780,Saving Mr. Banks,MOVIE,"Author P.L. Travers looks back on her childhood while reluctantly meeting with Walt Disney, who seeks to adapt her Mary Poppins books for the big screen.",2013,PG-13,126,"['comedy', 'drama']","['US', 'AU', 'GB']",,tt2140373,7.5,168005,19.91,7.351,disney
ts148974,Best in Bridal,SHOW,Best in Bridal on FYI follows two Illinois bridal shops run by former friends who compete to outwit and out-sell each other in the exciting world of bridal retail.,2014,TV-PG,21,['reality'],['US'],1,tt4176914,5.1,15,0.644,,disney
ts8050,Car S.O.S.,SHOW,Meet car enthusiast and TV presenter Tim Shaw and master mechanic Fuzz Townshend as they join forces to rescue rusty classic vehicles from their garage prisons,2013,,44,"['documentation', 'reality', 'european']",['GB'],11,tt3110590,8.1,861,19.269,7.6,disney
ts159834,When Sharks Attack,SHOW,"Terror-filled deep sea saga using underwater photography, gripping news archives & paralyzing testimony to investigate three mysterious and deadly recent shark attacks.",2013,TV-14,45,['documentation'],['US'],9,tt3097686,6.1,143,6.14,10,disney
tm235416,Area 51: The CIA's Secret,MOVIE,"This true story covers ground-breaking research into the aviation that took place at the Groom Lake Testing Facility, otherwise known as Area 51, which ensured US Aerial supremacy from the Cold War through to the present day.  Utilising CIA documents that have recently been declassified this programme identifies specific individuals who worked at the top secret base in a variety of roles – the radar specialists, pilots and security guards.  Their personal testimonies provide a unique impression not just of the work that was carried out, but of the site itself.  We reveal just how tight security had to be to keep the development of the U2, A12 and HAVE BLUE aviation programmes under wraps.  This is a film that concentrates on delivering history and factual accuracy in a fresh and engaging style – one that answers the question ‘what really happened at Area 51’?",2014,,44,['documentation'],['US'],,tt5199604,5.7,165,1.87,5.8,disney
tm161686,Survive and Advance,MOVIE,Documentary exploring the 1983 North Carolina State Wolfpack men's basketball team's success after being the underdogs in the competitions.,2013,,90,['documentation'],['US'],,,,,3.399,7.69,disney
tm186494,Youngstown Boys,MOVIE,"""Youngstown Boys"" explores class and power dynamics in college sports through the parallel, interconnected journeys of one-time dynamic running back Maurice Clarett and former elite head coach Jim Tressel. Clarett and Tressel emerged from opposite sides of the tracks in Youngstown, Ohio, and then joined for a magical season at Ohio State University in 2002 that produced the first national football championship for the school in over 30 years. Shortly thereafter, though, Clarett was suspended from college football and began a downward spiral that ended with a prison term. Tressel continued at Ohio State for another eight years before his career there also ended in scandal.",2013,,103,['documentation'],['US'],,tt3411032,7.3,96,3.128,6.2,disney
tm188023,The Book of Manning,MOVIE,Explores the personal and professional life of former NFL and Ole Miss quarterback Archie Manning and how the sudden loss of his father impacted his life and the way he and his wife Olivia raised their three sons.,2013,,120,"['documentation', 'sport']",['US'],,tt3062490,8,390,2.739,8.107,disney
tm149931,Jingle All the Way 2,MOVIE,Larry's daughter wants only one thing for Christmas - a talking bear. His daughter's step-dad intends to make sure that Larry can't get one.,2014,PG,93,"['family', 'comedy']",['US'],,,,,9.15,5.433,disney
tm166468,Planes,MOVIE,"Dusty is a cropdusting plane who dreams of competing in a famous aerial race. The problem? He is hopelessly afraid of heights. With the support of his mentor Skipper and a host of new friends, Dusty sets off to make his dreams come true.",2013,PG,91,"['comedy', 'family', 'fantasy', 'sport', 'animation']",['US'],,tt1691917,5.7,47763,24.812,5.876,disney
tm143057,The Day The Series Stopped,MOVIE,"On Oct. 17, 1989, at 5:04 p.m. PT, soon after Al Michaels and Tim McCarver started the ABC telecast for Game 3 of the World Series between the San Francisco Giants and the Oakland Athletics, the ground began to shake beneath Candlestick Park. Even before that moment, this had promised to be a memorable matchup: the first in 33 years between teams from the same metropolitan area, a battle featuring larger-than-life characters and equally colorful fan bases. But after the 6.9 Loma Prieta earthquake rolled through, bringing death and destruction, the Bay Area pulled together, and baseball took a backseat.",2014,,51,['drama'],['US'],,,,,1.763,7.2,disney
