id,title,type,description,release_year,age_certification,runtime,genres,production_countries,seasons,imdb_id,imdb_score,imdb_votes,tmdb_popularity,tmdb_score,platform
tm244126,Dark Phoenix,MOVIE,"The X-Men face their most formidable and powerful foe when one of their own, Jean Grey, starts to spiral out of control. During a rescue mission in outer space, Jean is nearly killed when she's hit by a mysterious cosmic force. Once she returns home, this force not only makes her infinitely more powerful, but far more unstable. The X-Men must now band together to save her soul and battle aliens that want to use Grey's new abilities to rule the galaxy.",2019,PG-13,114,"['scifi', 'action']",['US'],,tt6565702,5.7,176987,44.312,5.992,disney
tm375500,Onward,MOVIE,"In a suburban fantasy world, two teenage elf brothers embark on an extraordinary quest to discover if there is still a little magic left out there.",2020,PG,103,"['comedy', 'fantasy', 'family', 'animation', 'action', 'drama', 'scifi']",['US'],,tt7146812,7.4,163928,39.499,7.722,disney
tm9,Star Wars: The Rise of Skywalker,MOVIE,"The surviving Resistance faces the First Order once again as the journey of Rey, Finn and Poe Dameron continues. With the power and knowledge of generations behind them, the final battle begins.",2019,PG-13,141,"['action', 'scifi', 'drama', 'fantasy', 'european']",['US'],,tt2527338,6.4,480011,57.247,6.36,disney
tm423725,Maleficent: Mistress of Evil,MOVIE,"Maleficent and her goddaughter Aurora begin to question the complex family ties that bind them as they are pulled in different directions by impending nuptials, unexpected allies, and dark new forces at play.",2019,PG,119,"['action', 'family', 'fantasy', 'romance']",['US'],,tt4777008,6.6,99344,82.936,7.324,disney
tm354814,The Call of the Wild,MOVIE,"Buck is a big-hearted dog whose blissful domestic life is turned upside down when he is suddenly uprooted from his California home and transplanted to the exotic wilds of the Yukon during the Gold Rush of the 1890s. As the newest rookie on a mail delivery dog sled team—and later its leader—Buck experiences the adventure of a lifetime, ultimately finding his true place in the world and becoming his own master.",2020,PG,100,"['drama', 'family']","['US', 'CA']",,tt7504726,6.7,54304,48.406,7.6,disney
ts223001,Europe From Above,SHOW,"Using the very latest in drone and aerial photographic technology, tour across countries and their seasons, getting a unique view from above.",2019,,44,['documentation'],['GB'],5,tt11003514,8.1,614,30.844,7.2,disney
ts269251,Atlas Of Cursed Places,SHOW,"Author and adventurer Sam Sheridan travels the globe in search of the most cursed places on Earth. Entrenching himself in macabre modern day culture, Sam explores the region's haunting history and fascinating folklore, employs cutting-edge science to illuminate the dangers of the curse, and paints a new and revealing portrait of a doomed place and the people who live there in the process.",2020,TV-14,42,"['documentation', 'reality']",['US'],1,tt13554946,5.7,239,4.056,3,disney
tm863958,Back to the Titanic,MOVIE,Back to the Titanic documents the first manned dives to Titanic in nearly 15 years. New footage reveals fresh decay and sheds light on the ship’s future.,2020,PG,45,['documentation'],['US'],,tt12100782,6.2,438,5.765,6.2,disney
tm827478,One Day at Disney,MOVIE,Discover what it’s like to report to work every day for The Walt Disney Company. Step behind the scenes to immerse yourself in one “ordinary” day at Disney.,2019,,59,['documentation'],['US'],,tt11550148,7,520,4.783,6.9,disney
tm483905,Apollo: Missions to the Moon,MOVIE,"The Apollo space program: 12 manned-missions, one impossible goal. With rare archival footage and audio, this remarkable documentary sheds new light on an incredible time in human history.",2020,,94,"['documentation', 'history']",['US'],,tt9782756,7.5,620,8.046,7.3,disney
tm266656,Mulan,MOVIE,"When the Emperor of China issues a decree that one man per family must serve in the Imperial Chinese Army to defend the country from Huns, Hua Mulan, the eldest daughter of an honored warrior, steps in to take the place of her ailing father. She is spirited, determined and quick on her feet. Disguised as a man by the name of Hua Jun, she is tested every step of the way and must harness her innermost strength and embrace her true potential.",2020,PG-13,115,"['drama', 'fantasy', 'action']",['US'],,tt4566758,5.7,141848,55.505,6.9,disney
tm374091,Descendants 3,MOVIE,The teenagers of Disney's most infamous villains return to the Isle of the Lost to recruit a new batch of villainous offspring to join them at Auradon Prep.,2019,PG,106,"['fantasy', 'family']",['US'],,tt8022928,6.4,10012,46.999,7.7,disney
tm936998,Bin Laden's Hard Drive,MOVIE,Newly declassified hard drives taken from the compound where Osama bin Laden was killed reveal a groundbreaking look at his personal life.,2020,,44,['documentation'],['GB'],,tt14456932,5.5,221,2.257,8,disney
tm831100,Zombies 2,MOVIE,"The continuing adventures of Seabrook High students Addison and Zed, whose budding romance is threatened by the arrival of werewolves.",2020,,84,"['family', 'fantasy', 'romance', 'comedy']",['US'],,tt9766166,5.7,3464,15.235,7.602,disney
ts256051,Inside Pixar,SHOW,"This documentary series of personal and cinematic stories that provide an inside look into the people, artistry, and culture of Pixar Animation Studios.",2020,TV-G,10,"['documentation', 'family']",['US'],4,tt13302848,7.3,702,10.443,6.778,disney
ts220233,One Day at Disney,SHOW,Discover what it’s like to report to work every day for The Walt Disney Company. Step behind the scenes to immerse yourself in one “ordinary” day at Disney.,2019,TV-PG,6,['documentation'],['US'],1,tt10854760,7.3,581,24.781,7,disney
ts235604,Disney Insider,SHOW,"Peel back the curtain of The Walt Disney Company like never before. Tune in each week and go behind the movies, theme parks, destinations, music, toys, and more. Each episode offers three unique stories that capture the magical moments and heartfelt storytelling that is Disney.",2020,TV-PG,19,['documentation'],['US'],1,tt11998854,6.6,335,12.403,7,disney
ts222773,The Imagineering Story,SHOW,"Explore the past, present and future of Walt Disney Imagineering with noted filmmaker Leslie Iwerks. Ms. Iwerks comes from a family with deep Disney history — her grandfather was an early Disney animator and her father is a former Imagineer — and her previous work includes profiles of Pixar Animation Studios and visual effects house Industrial Light & Magic.",2019,TV-PG,63,['documentation'],['US'],1,,,,20.786,8.14,disney
tm11948,Toy Story 4,MOVIE,"Woody has always been confident about his place in the world and that his priority is taking care of his kid, whether that's Andy or Bonnie. But when Bonnie adds a reluctant new toy called ""Forky"" to her room, a road trip adventure alongside old and new friends will show Woody how big the world can be for a toy.",2019,G,100,"['animation', 'fantasy', 'family', 'comedy']",['US'],,tt1979376,7.7,233342,73.547,7.514,disney
tm937152,Burrow,MOVIE,"A young rabbit embarks on a journey to dig the burrow of her dreams, despite not having a clue what she's doing.",2020,G,6,"['animation', 'family', 'comedy']",['US'],,tt13167288,,,7.24,7.5,disney
ts237729,Zenimation,SHOW,"Unplug, relax, and refresh your senses for a moment of mindfulness with Walt Disney Animation Studios’ Zenimation - an animated soundscape experience.",2020,TV-G,10,"['scifi', 'family', 'animation']",['US'],2,tt12372034,7.5,484,51.405,7.75,disney
tm974117,Godmothered,MOVIE,"A young and unskilled fairy godmother that ventures out on her own to prove her worth by tracking down a young girl whose request for help was ignored. What she discovers is that the girl has now become a grown woman in need of something very different than a ""prince charming.""",2020,PG,110,"['comedy', 'fantasy', 'drama', 'family']",['US'],,tt11681250,6.1,13424,16.709,6.813,disney
ts287331,Gordon Ramsay: Uncharted,SHOW,"Follow Gordon Ramsay as he meets with indigenous people around the globe to learn about the cultures, dishes and flavors unique to each location. Each episode concludes with Ramsay challenging himself with a local food legend by his side - putting his newfound skills to the test as they cook a feast together for the natives.",2019,TV-14,52,"['documentation', 'reality']",['US'],3,tt9165706,7.7,1726,10.009,7.8,disney
ts88328,Hostile Planet,SHOW,This six part documentary draws attention to the most extraordinary — almost supernatural — accounts of animals that have adapted to the cruelest evolutionary curveballs.,2019,TV-PG,47,['documentation'],['US'],1,tt8390274,8.3,905,7.822,7.692,disney
tm832370,Eyewitness: D-Day,MOVIE,"One famous day. Five heroes. Five key turning points that changed the course of World War Two during the D Day landings, told through the eyes of the people who made a difference. Using rarely seen archive, dramatic reconstruction and written accounts from eye witnesses and personal testimony from our five heroes, this is D Day as never seen before.",2019,,44,['documentation'],['GB'],,tt10885884,6.6,97,1.539,6.9,disney
ts219040,Muppets Now,SHOW,"Scooter rushes to make his delivery deadlines and upload the brand-new Muppets series for streaming. They are due now, and he’ll need to navigate whatever obstacles, distractions, and complications the rest of the Muppet gang throw at him.",2020,TV-PG,27,"['comedy', 'family', 'reality']",['US'],1,tt10857210,5.9,1293,20.167,5.542,disney
ts252296,Becoming,SHOW,"The origin stories of 10 athletes, entertainers, and musicians. Each episode centers around a visit to the celebrity’s hometown, touring important locations central to their upbringing. A supporting cast of family members, coaches, teachers, mentors and friends are interviewed, sharing rarely heard anecdotes and insights into the star’s “becoming” story.",2020,TV-14,24,"['documentation', 'drama', 'family', 'history', 'sport']",['US'],1,tt12944764,7,69,6.073,6.8,disney
tm916669,Upside-Down Magic,MOVIE,"Nory and her best friend Reina enter the Sage Academy for Magical Studies, where Nory’s unconventional powers land her in a class for those with wonky, or “upside-down,” magic. Undaunted, Nory sets out to prove that that upside-down magic can be just as powerful as right-side-up.",2020,G,96,"['fantasy', 'family']","['US', 'CA']",,tt10833270,5.4,1925,29.707,7.161,disney
tm446576,Sea of Shadows,MOVIE,"The vaquita, the world’s smallest whale, is nearing extinction as its habitat is destroyed  by Mexican cartels and the Chinese Mafia, who harvest the totoaba fish, the “cocaine of the sea.” Environmental activists, the Mexican navy, and undercover investigators are fighting back against this illegal multimillion-dollar business.",2019,PG-13,106,"['documentation', 'crime', 'history', 'european']",['AT'],,tt9326056,7.3,770,5.884,7.7,disney
ts214210,Lost Cities with Albert Lin,SHOW,"Utilizing ground-penetrating radar, LiDar and 3D scanning, Lin will work with boots-on-the-ground archaeologists to discover and re-create unexcavated worlds still hidden beneath the earth.",2019,TV-14,44,"['documentation', 'history']",['US'],2,tt10366494,7.6,607,4.947,6.278,disney
tm898825,Surviving the Mount St. Helens Disaster,MOVIE,The 1980 eruption of Mount St. Helens was the deadliest in U.S. history. Survivor testimonies and rare images reveal the cataclysms it unleashed.,2020,,45,"['documentation', 'history']",['GB'],,tt12453440,7.3,162,2.147,4.5,disney
ts222714,Superstructures: Engineering Marvels,SHOW,"An exploration of engineering marvels. This brand new series reveals the extraordinary feats of engineering hidden inside the world's most spectacular man-made constructions. From the world's biggest plane and largest free-spanning dome to the tallest building and the largest space ship, each superstructure is taken apart using state-of-the-art CGI and insight from world class specialists to reveal the startling innovations that turn it from dream to reality.",2019,TV-G,45,['documentation'],['US'],1,tt11439910,7.4,73,7.914,6.167,disney
tm826979,Star Wars: Galaxy's Edge - Adventure Awaits,MOVIE,An exclusive behind-the-scenes look at the new lands at Walt Disney World Resort in Florida and Disneyland Resort in Southern California.,2019,,81,['documentation'],['US'],,tt10951528,5.7,202,2.766,6.167,disney
ts224501,Walt Disney Animation Studios: Short Circuit Experimental Films,SHOW,"If you could tell any story with the team of talented artists at Walt Disney Animation Studios, what would you create? Welcome to Short Circuit, an experimental, innovative program where anyone at the Studio can pitch an idea and get selected to create their own short film.",2020,TV-PG,5,"['animation', 'family', 'comedy']",['US'],2,tt12579042,7.5,678,15.502,7.914,disney
ts217745,Apollo: Back to the Moon,SHOW,"irected by François Pomès, this two-part documentary chronicles the epic adventure of the Apollo space program, which included both tragic setbacks and historic successes. The first phase takes place against a backdrop of the Cold War, from the disaster of the Apollo 1 mission to the triumph of the Apollo 8 mission. The last stage culminates with the Apollo 11 space flight which landed American astronauts Neil Armstrong and Buzz Aldrin on the Moon. With full-color archival images and 3D reenactments of the mission's key stages, this immersive account details the journey of the men and women who contributed to the celebrated Apollo 11 mission.",2019,,44,['documentation'],['FR'],1,,,,14.39,7.7,disney
tm207119,Dumbo,MOVIE,"A young elephant, whose oversized ears enable him to fly, helps save a struggling circus, but when the circus plans a new venture, Dumbo and his friends discover dark secrets beneath its shiny veneer.",2019,PG,112,"['fantasy', 'family']","['US', 'AU', 'CA', 'GB']",,tt3861390,6.3,73010,46.733,6.6,disney
ts266669,Marvel Battleworld: Mystery of the Thanostones,SHOW,"Can Iron Man and this rag-tag group - Captain Marvel, Spider-Ham, Groot, and Throg - figure out what the Mad Titan Thanos wants and why they've been brought to this strange, new world?",2020,,3,"['animation', 'action']",['US'],1,tt12583300,6,116,1.62,5,disney
tm244184,Frozen II,MOVIE,"Elsa, Anna, Kristoff and Olaf head far into the forest to learn the truth about an ancient mystery of their kingdom.",2019,PG,104,"['animation', 'action', 'comedy', 'fantasy', 'family', 'drama']",['US'],,tt4520988,6.8,187617,74.959,7.269,disney
ts237251,X-Ray Earth,SHOW,"Earth as it has never been seen before, by challenging preconceived notions about the world, making use of cutting-edge scientific tools, and travelling over, across and deep into the Earth's crust to learn just what makes the world tick.",2020,TV-14,44,['documentation'],['GB'],1,tt12988062,6.7,71,7.468,6.3,disney
ts220175,Buried Secrets of WWII,SHOW,"Remote sensing techniques tell the stories of WWII battles and campaigns, the details of which have been lost in the fog of war, misinterpreted or overtaken by the landscape.",2019,TV-14,44,"['documentation', 'war']",['GB'],1,tt12362380,7,86,2.479,6,disney
ts255749,The Knights of Castelcorvo,SHOW,"Secrets. Mysteries. And frightening magical beings. The small town of Castelcorvo is not as rested as it seems and just a bunch of brave knight can keep it safe. Four kids - Giulia, Riccardo, Betta and Matteo - will have to solve mysterious enigmas and face their greatest fears to become the paladins who fight the evil that lurks in Castelcorvo.",2020,TV-PG,21,['thriller'],['IT'],1,tt13302530,6,75,4.886,5,disney
ts249303,Spaced Out,SHOW,"A brand new series discovering amazing rooms built inside a home. Take trip out of this world to see the most spectacular rooms this galaxy has to offer. From a Star Wars basement to an underwater living room, you're not going to believe what's aboard these personal mother ships.",2019,,20,"['reality', 'documentation']",['GB'],1,tt8884276,,,0.6,,disney
tm411627,Kim Possible,MOVIE,"Everyday teen hero Kim Possible and her best friend Ron Stoppable embark on their freshman year of high school, all while saving the world from evil villains. While Kim and Ron have always been one step ahead of their opponents, navigating the social hierarchy of high school is more challenging than the action-hero ever imagined. With Drakken and Shego lurking in the wings, Kim must rely on her family and Team Possible—Ron, tech-genius Wade, new friend Athena, and Rufus, a Naked mole-rat.",2019,PG,86,"['action', 'comedy']",['US'],,tt7979492,3.7,3521,12.576,5.592,disney
ts317262,Ultimate Survival WWII,SHOW,Survival expert Hazen Audel travels across the globe to relive some of the most extraordinary stories of wilderness survival from World War II.,2019,,44,['documentation'],"['GB', 'US']",1,tt13779496,8.5,67,1.102,,disney
ts252221,Made in A Day,SHOW,"The last decade has seen a revolution in manufacturing. A just in time economy means the products we love are being made on a massive scale in record time. While lightening logistics mean global trade and distribution happens faster than ever. This is the story of how some of today's biggest brands, from Tesla Cars to Gibson Guitars, from Tabasco Sauce to Space Rockets, are made in America.",2020,,22,['documentation'],['US'],1,tt12833474,7.4,50,1.4,7.5,disney
ts105720,Bia,SHOW,"Bia loves to draw and paint. She and her two best friends spend time at Fundom, a place where they and influencers like to show off their talents. On the other hand, LAIX is a network in which its CEO only wants fame and money.",2019,TV-G,37,"['family', 'music', 'romance', 'action', 'comedy', 'drama']",['AR'],4,tt9168904,6.5,234,23.32,7.891,disney
ts216001,Out There with Jack Randall,SHOW,Zoologist Jack Randall journeys into Australia's Outback to encounter extraordinary wildlife.,2019,TV-14,44,['documentation'],['US'],1,tt10583412,6.1,87,3.839,6.3,disney
ts222579,Pixar in Real Life,SHOW,"This live action series brings iconic characters and moments from Pixar films into the real world. Filmed on location in and around New York City, the series surprises and delights real people in real locations when they least expect it.",2019,TV-G,4,"['family', 'comedy', 'reality']",['US'],1,tt11199558,6.5,867,3.268,6.5,disney
tm834281,Mack Wrestles,MOVIE,"Mack Beggs loved wrestling—it gave him a sense of purpose and a sense of self. ""Mack Wrestles"" takes the audience behind the scenes as this gifted athlete from Euless, Texas, struggles against the outside forces that stigmatize transgender athletes.",2019,,26,['documentation'],['US'],,tt10300664,,,1.4,,disney
ts218364,Kingdom of the White Wolf,SHOW,"Ronan Donovan, a National Geographic researcher, travels to the Arctic to study wolves.",2019,TV-PG,44,['documentation'],['US'],1,tt10704300,8,282,8.864,7.2,disney
ts251915,India from Above,SHOW,"In India From Above, cutting-edge aerial footage reveals how India, which is at once both modern and steeped in ancient mysticism, is shaped by its developed and untouched landscapes.",2020,TV-PG,43,['documentation'],['US'],1,,,,6.21,5,disney
tm468061,Lamp Life,MOVIE,Bo Peep explains what happened to herself and her sheep between the events of Toy Story 2 and Toy Story 4.,2020,G,7,['comedy'],['US'],,tt10167262,,,14.101,7.17,disney
tm898664,Akashinga: The Brave Ones,MOVIE,"Single mothers, abandoned wives and survivors of sexual and domestic violence enroll in an intense training selection to join rangers protecting elephants from poachers across Africa.",2020,,13,['documentation'],['US'],,tt12191656,8.2,,1.799,7,disney
tm892844,Long Gone Summer,MOVIE,"An examination of the 1998 MLB season and the home run race between Mark McGwire and Sammy Sosa. The two sluggers' race to hit the most home runs, later overshadowed by the steroid scandal, left a permanent mark on baseball history.",2020,,104,['documentation'],['US'],,,,,2.647,5.8,disney
tm452729,Kitbull,MOVIE,"An unlikely connection sparks between two creatures: a fiercely independent stray kitten and a pit bull. Together, they experience friendship for the first time.",2019,PG,9,['drama'],['US'],,,,,6.838,8.012,disney
ts269854,Disney Parks Sunrise Series,SHOW,"At daybreak, the first rays of sunlight gleam through the spires of Cinderella Castle, beam between the remarkable branches of The Tree of Life, and shimmer onto the brilliant sphere of Spaceship Earth. It’s a view of Disney Parks not often enough enjoyed – at sunrise.",2020,TV-G,59,['reality'],['US'],1,tt27983388,,,1.371,6.5,disney
tm405465,Lady and the Tramp,MOVIE,"The love story between a pampered Cocker Spaniel named Lady and a streetwise mongrel named Tramp. Lady finds herself out on the street after her owners have a baby and is saved from a pack by Tramp, who tries to show her to live her life footloose and collar-free.",2019,PG,111,"['romance', 'family', 'comedy']",['US'],,tt8096832,6.2,23839,20.624,7.232,disney
tm916947,Hamilton: History Has Its Eyes On You,MOVIE,"An intimate discussion about the groundbreaking musical that has become a global phenomenon featuring Hamilton's creator, its director, and cast members of the original Broadway production.  A Harvard Historian also shares insight on the historical relevance and accuracy of the production.",2020,PG,46,['documentation'],['US'],,tt12690910,6.5,80,2.32,7,disney
tm977575,Folklore: The Long Pond Studio Sessions,MOVIE,"An intimate concert film, in which Taylor Swift performs each song from her album 'folklore' in order, as she reveals the meaning and the stories behind all 17 tracks for the very first time.",2020,PG-13,106,"['music', 'documentation', 'drama']",['US'],,tt13524234,8.4,4413,12.64,8.6,disney
tm996369,Shook,MOVIE,"""Shook"" centers around Mia, a 15-year-old who yearns to dance professionally but is hindered by daily obligations to her little sister, Skylar, and their single mom, a registered nurse.",2020,G,53,"['comedy', 'family']",['US'],,tt10847114,7.9,,0.861,,disney
tm376183,Penguins,MOVIE,"The story of Steve, an Adélie penguin, on a quest to find a life partner and start a family. When Steve meets with Wuzzo the emperor penguin they become friends. But nothing comes easy in the icy Antarctic.",2019,G,107,"['family', 'documentation', 'action']",['AU'],,tt8080302,7.1,1824,3.929,6.9,disney
tm850243,Mars: One Day on the Red Planet,MOVIE,An epic journey around Mars — built from real satellite and rover data — revealing the red planet as you’ve never seen it before.,2020,,88,['documentation'],['US'],,tt12611334,7,469,5.447,6.4,disney
tm961182,Expedition Everest,MOVIE,"Just inside Everest's notorious death zone, a team of climate scientists who specialize in extreme weather weigh their next move.",2020,PG,42,['documentation'],['US'],,tt13009970,6.5,181,5.219,6.6,disney
ts256265,Lance,SHOW,A personal examination of the rise and fall of Lance Armstrong.,2020,,101,['documentation'],['US'],1,tt11427436,7.5,1297,7.873,6.7,disney
tm931428,Once Upon a Snowman,MOVIE,"The previously untold origins of Olaf, the innocent and insightful, summer-loving snowman are revealed as we follow Olaf’s first steps as he comes to life and searches for his identity in the snowy mountains outside Arendelle.",2020,G,7,"['animation', 'fantasy', 'family']",['US'],,,,,20.677,6.9,disney
tm842501,Marvel Studios: Expanding the Universe,MOVIE,An exciting look into the future of Marvel Studios' films and upcoming Disney+ series.,2019,PG,12,['documentation'],['US'],,,,,6.483,5.7,disney
ts286382,Secrets of the Zoo: Tampa,SHOW,Embrace the wild side of the Sunshine State with a stellar zoo team devoted to the exotic cast of animals.,2020,TV-PG,44,"['documentation', 'family']",['US'],4,tt11708046,8.4,110,5.33,9.6,disney
ts254539,Wild Nordic,SHOW,"As seen by the Viking gods, the fabled wildernesses of Norway, Finland and Sweden are revealed from the skies above.",2019,,44,['documentation'],['US'],1,tt14072300,7.4,108,12.747,4.5,disney
ts77182,101 Dalmatian Street,SHOW,"Follow the adventures of eldest siblings Dolly and Dylan, their Mum Delilah and Dad Doug, and their 97 younger brothers and sisters as they embark on urban adventures and extreme sibling rivalry. Together, the pups explore growing up and finding their own spot inside the biggest, messiest, furriest blended family ever.",2019,TV-Y7,17,"['animation', 'comedy', 'family']",['GB'],1,tt7019028,5.9,468,46.631,7.3,disney
ts268033,Secrets of the Zoo: North Carolina,SHOW,"North Carolina is home to the world's largest zoo, with 2,600 acres, large natural habitats and more than 1,800 animals in its care. The show features several Zoo staff, including keepers and veterinarians, and highlight stories, including routine animal husbandry, emergency procedures and the Zoo’s work in conservation and rescue and release of injured wildlife",2020,TV-14,44,"['documentation', 'reality']",['US'],1,tt13528684,8.2,69,0.933,2,disney
tm936285,Miraculous World : New York – United HeroeZ,MOVIE,"During a school field trip, Ladybug and Cat Noir meet the American superheroes, whom they have to save from an akumatized super-villain. They will also discover that Miraculous exist in the United States, too.",2020,PG,52,"['animation', 'fantasy', 'action']","['KR', 'GB', 'BR', 'CA', 'FR']",,,,,115.507,7.2,disney
ts90413,Gigantosaurus,SHOW,"Four curious young dinosaur friends explore the mystery of Gigantosaurus, the largest, fiercest dinosaur of all, facing their individual fears and working together to solve problems during their many adventures.",2019,TV-G,12,['animation'],"['FR', 'US']",3,tt9636800,6.7,228,33.122,6.9,disney
tm855130,Lost Temple of The Inca,MOVIE,"In the mountains of Peru, an environmental scientist discovers ancient artifacts submerged beneath the headwaters of the Amazon; his findings could save this sacred landscape from mining devastation.",2020,PG,42,"['thriller', 'documentation']",['US'],,tt11668444,6.7,166,1.834,6.5,disney
